

================================================================
== Vitis HLS Report for 'sendoutstream'
================================================================
* Date:           Mon May 27 13:33:48 2024

* Version:        2022.1 (Build 3526262 on Mon Apr 18 15:47:01 MDT 2022)
* Project:        hls_userdma.prj
* Solution:       solution1 (Vivado IP Flow Target)
* Product family: zynq
* Target device:  xc7z020-clg400-1


================================================================
== Performance Estimates
================================================================
+ Timing: 
    * Summary: 
    +--------+----------+----------+------------+
    |  Clock |  Target  | Estimated| Uncertainty|
    +--------+----------+----------+------------+
    |ap_clk  |  10.00 ns|  3.634 ns|     2.70 ns|
    +--------+----------+----------+------------+

+ Latency: 
    * Summary: 
    +---------+---------+----------+----------+-----+-----+---------+
    |  Latency (cycles) |  Latency (absolute) |  Interval | Pipeline|
    |   min   |   max   |    min   |    max   | min | max |   Type  |
    +---------+---------+----------+----------+-----+-----+---------+
    |        ?|        ?|         ?|         ?|    ?|    ?|       no|
    +---------+---------+----------+----------+-----+-----+---------+

    + Detail: 
        * Instance: 
        N/A

        * Loop: 
        N/A

============================================================
+ Verbose Summary: Synthesis Manager
============================================================
InlineROM: 1
ExposeGlobal: 0
============================================================
+ Verbose Summary: CDFG Model
============================================================
IsTopModel: 0
ResetActiveHigh: 1
IsCombinational: 2
IsDatapathOnly: 0
HasWiredReturn: 1
HasMFsm: 0
HasVarLatency: 1
IsPipeline: 0
IsRtlPipelined: 0
IsInstanceOverlapped: 0
IsDontTouch: 0
HasImplIP: 0
IsGatedGlobalClock: 0


============================================================
+ Verbose Summary: Schedule
============================================================
* Number of FSM states : 4
* Pipeline : 0
* Dataflow Pipeline: 0

* FSM state transitions: 
1 --> 2 
2 --> 3 
3 --> 4 
4 --> 

* FSM state operations: 

State 1 <SV = 0> <Delay = 3.63>
ST_1 : Operation 5 [1/1] (3.63ns)   --->   "%in_en_clrsts_read = read i1 @_ssdm_op_Read.ap_fifo.i1P0A, i1 %in_en_clrsts"   --->   Operation 5 'read' 'in_en_clrsts_read' <Predicate = true> <Delay = 3.63> <CoreInst = "FIFO_SRL">   --->   Core 81 'FIFO_SRL' <Latency = 0> <II = 1> <Delay = 3.63> <Storage> <Opcode : 'read' 'write' 'nbread' 'nbwrite'> <Ports = 0> <Width = 1> <Depth = 2> <FIFO>

State 2 <SV = 1> <Delay = 0.97>
ST_2 : Operation 6 [1/1] (0.00ns)   --->   "%empty = wait i32 @_ssdm_op_Wait"   --->   Operation 6 'wait' 'empty' <Predicate = true> <Delay = 0.00>
ST_2 : Operation 7 [2/2] (0.00ns)   --->   "%call_ln0 = call void @sendoutstream_Pipeline_VITIS_LOOP_117_1, i33 %outbuf, i32 %outStreamTop_V_data_V, i4 %outStreamTop_V_keep_V, i4 %outStreamTop_V_strb_V, i2 %outStreamTop_V_user_V, i1 %outStreamTop_V_last_V"   --->   Operation 7 'call' 'call_ln0' <Predicate = true> <Delay = 0.00> <CoreType = "Generic">   --->   Core 0 '' <Latency = 0> <II = 1> <Delay = 1.00> <Generic> <Opcode : >
ST_2 : Operation 8 [1/1] (0.97ns)   --->   "%xor_ln127 = xor i1 %in_en_clrsts_read, i1 1" [userdma.cpp:127]   --->   Operation 8 'xor' 'xor_ln127' <Predicate = true> <Delay = 0.97> <CoreInst = "LogicGate">   --->   Core 74 'LogicGate' <Latency = 0> <II = 1> <Delay = 0.97> <FuncUnit> <Opcode : 'and' 'or' 'xor'> <InPorts = 2> <OutPorts = 1>
ST_2 : Operation 9 [1/1] (0.00ns)   --->   "%write_ln127 = write void @_ssdm_op_Write.ap_auto.i1P0A, i1 %m2s_buf_sts, i1 %xor_ln127" [userdma.cpp:127]   --->   Operation 9 'write' 'write_ln127' <Predicate = true> <Delay = 0.00>

State 3 <SV = 2> <Delay = 3.56>
ST_3 : Operation 10 [1/2] (3.56ns)   --->   "%call_ln0 = call void @sendoutstream_Pipeline_VITIS_LOOP_117_1, i33 %outbuf, i32 %outStreamTop_V_data_V, i4 %outStreamTop_V_keep_V, i4 %outStreamTop_V_strb_V, i2 %outStreamTop_V_user_V, i1 %outStreamTop_V_last_V"   --->   Operation 10 'call' 'call_ln0' <Predicate = true> <Delay = 3.56> <CoreType = "Generic">   --->   Core 0 '' <Latency = 0> <II = 1> <Delay = 1.00> <Generic> <Opcode : >

State 4 <SV = 3> <Delay = 0.00>
ST_4 : Operation 11 [1/1] (0.00ns)   --->   "%specinterface_ln0 = specinterface void @_ssdm_op_SpecInterface, i1 %in_en_clrsts, void @ap_fifo_str, i32 0, i32 0, void @p_str, i32 0, i32 0, void @p_str, void @p_str, void @p_str, i32 2, i32 2, i32 16, i32 16, void @p_str, void @ScalarProp_str, i32 4294967295, i32 0"   --->   Operation 11 'specinterface' 'specinterface_ln0' <Predicate = true> <Delay = 0.00>
ST_4 : Operation 12 [1/1] (0.00ns)   --->   "%specinterface_ln0 = specinterface void @_ssdm_op_SpecInterface, i33 %outbuf, void @empty_6, i32 0, i32 0, void @empty_2, i32 0, i32 0, void @empty_2, void @empty_2, void @empty_2, i32 0, i32 0, i32 0, i32 0, void @empty_2, void @empty_2, i32 4294967295, i32 0"   --->   Operation 12 'specinterface' 'specinterface_ln0' <Predicate = true> <Delay = 0.00>
ST_4 : Operation 13 [1/1] (0.00ns)   --->   "%specinterface_ln0 = specinterface void @_ssdm_op_SpecInterface, i1 %outStreamTop_V_last_V, i2 %outStreamTop_V_user_V, i4 %outStreamTop_V_strb_V, i4 %outStreamTop_V_keep_V, i32 %outStreamTop_V_data_V, void @empty_25, i32 1, i32 1, void @empty_24, i32 0, i32 0, void @empty_2, void @empty_2, void @empty_2, i32 0, i32 0, i32 0, i32 0, void @empty_2, void @empty_2, i32 4294967295, i32 0"   --->   Operation 13 'specinterface' 'specinterface_ln0' <Predicate = true> <Delay = 0.00>
ST_4 : Operation 14 [1/1] (0.00ns)   --->   "%ret_ln129 = ret" [userdma.cpp:129]   --->   Operation 14 'ret' 'ret_ln129' <Predicate = true> <Delay = 0.00>


============================================================
+ Verbose Summary: Timing violations
============================================================
Target clock period: 10ns, clock uncertainty: 2.7ns.

 <State 1>: 3.63ns
The critical path consists of the following:
	fifo read operation ('in_en_clrsts_read') on port 'in_en_clrsts' [10]  (3.63 ns)

 <State 2>: 0.978ns
The critical path consists of the following:
	'xor' operation ('xor_ln127', userdma.cpp:127) [15]  (0.978 ns)

 <State 3>: 3.56ns
The critical path consists of the following:
	'call' operation ('call_ln0') to 'sendoutstream_Pipeline_VITIS_LOOP_117_1' [14]  (3.56 ns)

 <State 4>: 0ns
The critical path consists of the following:


============================================================
+ Verbose Summary: Binding
============================================================
N/A
* FSMD analyzer results:
  - Output states:
 - Input state : 
  - Chain level:
	State 1
	State 2
	State 3
	State 4


============================================================
+ Verbose Summary: Datapath Resource usage 
============================================================
N/A
